{"authority":"advisory","export_profile":"core-minimal","namespaces":{"ak":"https://atomic-kernel.dev/ns#","rdf":"http://www.w3.org/1999/02/22-rdf-syntax-ns#","rdfs":"http://www.w3.org/2000/01/rdf-schema#"},"source_frame_hash":"abababababababababababababababababababababababababababababababab","triples":[{"o":"ak:node/n.payment_service","o_kind":"iri","p":"ak:asserts","s":"ak:assert/ea.inf.depends.1"},{"o":"0.95","o_kind":"literal","p":"ak:confidence","s":"ak:assert/ea.inf.depends.1"},{"o":"edge:e_calls","o_kind":"literal","p":"ak:evidenceRef","s":"ak:assert/ea.inf.depends.1"},{"o":"edge:e_imports","o_kind":"literal","p":"ak:evidenceRef","s":"ak:assert/ea.inf.depends.1"},{"o":"Import and call graph edges indicate dependency.","o_kind":"literal","p":"ak:rationale","s":"ak:assert/ea.inf.depends.1"},{"o":"abababababababababababababababababababababababababababababababab","o_kind":"literal","p":"ak:sourceFrameHash","s":"ak:assert/ea.inf.depends.1"},{"o":"ak:inferred","o_kind":"iri","p":"ak:status","s":"ak:assert/ea.inf.depends.1"},{"o":"ak:EpistemicAssertion","o_kind":"iri","p":"rdf:type","s":"ak:assert/ea.inf.depends.1"},{"o":"python","o_kind":"literal","p":"ak:prop/language","s":"ak:node/n.payment_gateway"},{"o":"false","o_kind":"literal","p":"ak:prop/public","s":"ak:node/n.payment_gateway"},{"o":"abababababababababababababababababababababababababababababababab","o_kind":"literal","p":"ak:sourceFrameHash","s":"ak:node/n.payment_gateway"},{"o":"ak:Node","o_kind":"iri","p":"rdf:type","s":"ak:node/n.payment_gateway"},{"o":"PaymentGateway","o_kind":"literal","p":"rdfs:label","s":"ak:node/n.payment_gateway"},{"o":"ak:node/n.payment_gateway","o_kind":"iri","p":"ak:depends_on","s":"ak:node/n.payment_service"},{"o":"python","o_kind":"literal","p":"ak:prop/language","s":"ak:node/n.payment_service"},{"o":"true","o_kind":"literal","p":"ak:prop/public","s":"ak:node/n.payment_service"},{"o":"abababababababababababababababababababababababababababababababab","o_kind":"literal","p":"ak:sourceFrameHash","s":"ak:node/n.payment_service"},{"o":"ak:Node","o_kind":"iri","p":"rdf:type","s":"ak:node/n.payment_service"},{"o":"PaymentService","o_kind":"literal","p":"rdfs:label","s":"ak:node/n.payment_service"},{"o":"1.0","o_kind":"literal","p":"ak:confidence","s":"ak:topology/te.depends.1"},{"o":"ak:node/n.payment_service","o_kind":"iri","p":"ak:from","s":"ak:topology/te.depends.1"},{"o":"abababababababababababababababababababababababababababababababab","o_kind":"literal","p":"ak:sourceFrameHash","s":"ak:topology/te.depends.1"},{"o":"ak:node/n.payment_gateway","o_kind":"iri","p":"ak:to","s":"ak:topology/te.depends.1"},{"o":"ak:TopologyEdge","o_kind":"iri","p":"rdf:type","s":"ak:topology/te.depends.1"}],"v":"ak.rdf_export.v0"}
